{
  "$schema": "../../schema.json",
  "name": "tanker",
  "displayName": "Tanker",
  "version": "1.0",
  "category": "display",
  "designer": "Indian Type Foundry",
  "license": {
    "type": "Fontshare Free Font License",
    "url": "https://www.fontshare.com/fonts/tanker#notice-to-user"
  },
  "source": "https://www.fontshare.com/fonts/tanker",
  "variable": false,
  "weights": [400],
  "styles": ["normal"],
  "fallback": "sans-serif",
  "previewText": "Bold headlines that demand attention.",
  "description": "A high-contrast, ultra-bold display sans-serif with tightly packed letterforms, built for impactful headlines and posters.",
  "submittedBy": { "github": "MRMCBlob" },
  "files": [
    { "path": "/r/fonts/tanker/Tanker-Regular.woff2", "weight": 400, "style": "normal" }
  ]
}
