{
  "$schema": "../../schema.json",
  "name": "goorm-sans",
  "displayName": "Goorm Sans",
  "version": "1.0",
  "category": "sans",
  "designer": "Goorm",
  "license": {
    "type": "OFL-1.1",
    "url": "https://openfontlicense.org"
  },
  "source": "https://goorm.co",
  "variable": false,
  "weights": [400, 500, 700],
  "styles": ["normal"],
  "fallback": "sans-serif",
  "previewText": "Clear interfaces need steady typography.",
  "description": "A stable and readable sans-serif family from Goorm, designed for clear use across design systems and digital products.",
  "submittedBy": {
    "github": "thisisbremlo"
  },
  "files": [
    {
      "path": "/r/fonts/goorm-sans/goorm-sans-regular.woff2",
      "weight": 400,
      "style": "normal"
    },
    {
      "path": "/r/fonts/goorm-sans/goorm-sans-medium.woff2",
      "weight": 500,
      "style": "normal"
    },
    {
      "path": "/r/fonts/goorm-sans/goorm-sans-bold.woff2",
      "weight": 700,
      "style": "normal"
    }
  ]
}
